{
  "$schema": "https://json-schema.org/draft/2020-12/schema",
  "$id": "https://raw.githubusercontent.com/GautierDorval/q-ledger/main/schemas/q-metrics.schema.json",
  "title": "Q-Metrics",
  "type": "object",
  "additionalProperties": false,
  "required": [
    "type",
    "schemaVersion",
    "generated_utc",
    "site",
    "canonical",
    "derived_from",
    "disclosure_token",
    "metrics",
    "stability",
    "notes",
    "traceability"
  ],
  "properties": {
    "type": {
      "type": "string",
      "const": "q-metrics"
    },
    "schemaVersion": {
      "type": "string"
    },
    "generated_utc": {
      "type": "string",
      "format": "date-time"
    },
    "site": {
      "type": "string",
      "format": "uri"
    },
    "canonical": {
      "type": "string",
      "format": "uri"
    },
    "derived_from": {
      "type": "array",
      "minItems": 1,
      "items": {
        "type": "string",
        "format": "uri"
      }
    },
    "disclosure_token": {
      "type": "string",
      "minLength": 1
    },
    "metrics": {
      "type": "object",
      "additionalProperties": false,
      "required": [
        "entry_compliance_rate",
        "constraint_touch_rate",
        "escape_rate",
        "sequence_fidelity"
      ],
      "properties": {
        "entry_compliance_rate": {
          "type": "number",
          "minimum": 0.0,
          "maximum": 1.0
        },
        "constraint_touch_rate": {
          "type": "number",
          "minimum": 0.0,
          "maximum": 1.0
        },
        "escape_rate": {
          "type": "number",
          "minimum": 0.0,
          "maximum": 1.0
        },
        "sequence_fidelity": {
          "type": "number",
          "minimum": 0.0,
          "maximum": 1.0
        }
      }
    },
    "stability": {
      "type": "string",
      "enum": [
        "low",
        "medium",
        "high",
        "unknown"
      ]
    },
    "notes": {
      "type": "array",
      "items": {
        "type": "string"
      }
    },
    "traceability": {
      "type": "object",
      "additionalProperties": true
    }
  }
}
