{
  "type": "q-metrics",
  "schemaVersion": "0.1.0",
  "generated_utc": "2026-02-17T00:00:00Z",
  "site": "https://example.com/",
  "canonical": "https://example.com/.well-known/q-metrics.json",
  "derived_from": [
    "https://example.com/.well-known/q-ledger.json"
  ],
  "disclosure_token": "Q-LEDGER-DISCLOSED",
  "metrics": {
    "entry_compliance_rate": 1.0,
    "constraint_touch_rate": 0.0,
    "escape_rate": 0.0,
    "sequence_fidelity": 1.0
  },
  "stability": "high",
  "notes": [
    "Derived from Q-Ledger sessions inferred from logs.",
    "This file is observational. It does not assert identity or intent."
  ],
  "traceability": {
    "q_ledger": "https://example.com/.well-known/q-ledger.json",
    "q_ledger_yaml": "https://example.com/.well-known/q-ledger.yml",
    "q_metrics": "https://example.com/.well-known/q-metrics.json",
    "q_metrics_yaml": "https://example.com/.well-known/q-metrics.yml",
    "q_attest_protocol": "https://example.com/.well-known/q-attest-protocol.md",
    "changelog": "https://example.com/changelog-ai.md"
  }
}
